{
  "schema_version": 1,
  "producer": "cua-spacesd",
  "started_at": "2026-10-03T22:20:27.133708237+00:00",
  "spacesd": {
    "version": "0.5.2",
    "protocol_revision": 8,
    "git_sha": "fe6d89d8049d61e4beab66dbeabc176c216e114f",
    "cua_driver_version": "0.33.1"
  },
  "image": {
    "name": "bench-osworld",
    "ref": "",
    "variant": "containerdisk",
    "os": "linux",
    "manifest_sha256": "b79e700e7a3871a786300a4417851aaf7a81c82224429e8be266c870ab49a5dc",
    "manifest_source": "/etc/cua-image/manifest.json"
  },
  "environment": {
    "runtime": "qemu",
    "runtime_detail": "Standard PC (Q35 + ICH9, 2009)",
    "arch": "x86_64",
    "init": "systemd",
    "display_server": "x11",
    "os": "Ubuntu 22.04"
  },
  "summary": {
    "status": "pass",
    "pass": 95,
    "warn": 0,
    "fail": 0,
    "skip": 12,
    "duration_ms": 13603,
    "strict": true
  },
  "checks": [
    {
      "id": "meta.target",
      "group": "meta",
      "status": "pass",
      "severity": "info",
      "claimed_by": [],
      "message": "checked running service at http://127.0.0.1:3211",
      "remediation": "",
      "duration_ms": 0,
      "facts": {
        "kind": "running service"
      },
      "artifacts": []
    },
    {
      "id": "meta.spacesd.reachable",
      "group": "meta",
      "status": "pass",
      "severity": "required",
      "claimed_by": [
        "core"
      ],
      "message": "cua-spacesd 0.5.2 (protocol 1.8) answers GetCapabilities over Native",
      "remediation": "",
      "duration_ms": 0,
      "facts": {
        "protocol_revision": "8",
        "version": "0.5.2"
      },
      "artifacts": []
    },
    {
      "id": "meta.protocol_revision",
      "group": "meta",
      "status": "pass",
      "severity": "required",
      "claimed_by": [
        "core"
      ],
      "message": "server protocol 1.8, doctor built for 1.8",
      "remediation": "",
      "duration_ms": 0,
      "facts": {},
      "artifacts": []
    },
    {
      "id": "meta.manifest",
      "group": "meta",
      "status": "pass",
      "severity": "required",
      "claimed_by": [
        "core"
      ],
      "message": "bench-osworld (linux containerdisk, amd64) from /etc/cua-image/manifest.json",
      "remediation": "",
      "duration_ms": 0,
      "facts": {
        "sha256": "b79e700e7a3871a786300a4417851aaf7a81c82224429e8be266c870ab49a5dc"
      },
      "artifacts": []
    },
    {
      "id": "meta.spacesd.pin",
      "group": "meta",
      "status": "pass",
      "severity": "required",
      "claimed_by": [
        "manifest:spacesd"
      ],
      "message": "cua-spacesd 0.5.2 matches the image manifest",
      "remediation": "",
      "duration_ms": 0,
      "facts": {
        "manifest_version": "0.5.2"
      },
      "artifacts": []
    },
    {
      "id": "meta.health",
      "group": "meta",
      "status": "pass",
      "severity": "required",
      "claimed_by": [
        "core"
      ],
      "message": "3 components serving",
      "remediation": "",
      "duration_ms": 5,
      "facts": {
        "component.desktop": "Serving",
        "component.filesystem": "Serving",
        "component.process": "Serving"
      },
      "artifacts": []
    },
    {
      "id": "meta.print_config",
      "group": "meta",
      "status": "pass",
      "severity": "required",
      "claimed_by": [
        "core"
      ],
      "message": "/usr/local/bin/cua-spacesd --print-config: version 0.5.2, protocol revision 8, listen 0.0.0.0:3211",
      "remediation": "",
      "duration_ms": 13,
      "facts": {
        "listen": "0.0.0.0:3211",
        "token_source": "file:/run/cua/env-token"
      },
      "artifacts": []
    },
    {
      "id": "capabilities.limitations",
      "group": "capabilities",
      "status": "pass",
      "severity": "required",
      "claimed_by": [
        "core"
      ],
      "message": "36 features reported; every unsupported one names its limitation",
      "remediation": "",
      "duration_ms": 0,
      "facts": {
        "supported": "a11y,audio.desktop,audio.opus,audio.per_app,audio.uplink,background_input,clipboard.files,clipboard.image,clipboard.text,desktop_stream,driver,fs_watch,h264_sw,hotspot,launch_app,presence,presence.cursor_shape,pty,quic_media,relay_attach,teleport.chrome,teleport.claude-code,teleport.discord,teleport.firefox,teleport.notion,teleport.slack,teleport.steam,teleport.unity-hub,teleport.vscode,teleport.whatsapp,teleport.wipe,tunnel.forward,volume.mount,window_stream,windows"
      },
      "artifacts": []
    },
    {
      "id": "capabilities.required.pty",
      "group": "capabilities",
      "status": "pass",
      "severity": "required",
      "claimed_by": [
        "feature:pty"
      ],
      "message": "pty supported",
      "remediation": "",
      "duration_ms": 0,
      "facts": {},
      "artifacts": []
    },
    {
      "id": "capabilities.required.fs_watch",
      "group": "capabilities",
      "status": "pass",
      "severity": "required",
      "claimed_by": [
        "feature:fs_watch"
      ],
      "message": "fs_watch supported",
      "remediation": "",
      "duration_ms": 0,
      "facts": {},
      "artifacts": []
    },
    {
      "id": "capabilities.required.driver",
      "group": "capabilities",
      "status": "pass",
      "severity": "required",
      "claimed_by": [
        "feature:driver"
      ],
      "message": "driver supported",
      "remediation": "",
      "duration_ms": 0,
      "facts": {},
      "artifacts": []
    },
    {
      "id": "capabilities.required.windows",
      "group": "capabilities",
      "status": "pass",
      "severity": "required",
      "claimed_by": [
        "feature:windows"
      ],
      "message": "windows supported",
      "remediation": "",
      "duration_ms": 0,
      "facts": {},
      "artifacts": []
    },
    {
      "id": "capabilities.optional.a11y",
      "group": "capabilities",
      "status": "pass",
      "severity": "recommended",
      "claimed_by": [
        "feature:a11y"
      ],
      "message": "a11y supported",
      "remediation": "",
      "duration_ms": 0,
      "facts": {},
      "artifacts": []
    },
    {
      "id": "capabilities.optional.background_input",
      "group": "capabilities",
      "status": "pass",
      "severity": "recommended",
      "claimed_by": [
        "feature:background_input"
      ],
      "message": "background_input supported",
      "remediation": "",
      "duration_ms": 0,
      "facts": {},
      "artifacts": []
    },
    {
      "id": "capabilities.optional.desktop_stream",
      "group": "capabilities",
      "status": "pass",
      "severity": "recommended",
      "claimed_by": [
        "feature:desktop_stream"
      ],
      "message": "desktop_stream supported",
      "remediation": "",
      "duration_ms": 0,
      "facts": {},
      "artifacts": []
    },
    {
      "id": "capabilities.optional.window_stream",
      "group": "capabilities",
      "status": "pass",
      "severity": "recommended",
      "claimed_by": [
        "feature:window_stream"
      ],
      "message": "window_stream supported",
      "remediation": "",
      "duration_ms": 0,
      "facts": {},
      "artifacts": []
    },
    {
      "id": "capabilities.optional.h264_sw",
      "group": "capabilities",
      "status": "pass",
      "severity": "recommended",
      "claimed_by": [
        "feature:h264_sw"
      ],
      "message": "h264_sw supported",
      "remediation": "",
      "duration_ms": 0,
      "facts": {},
      "artifacts": []
    },
    {
      "id": "capabilities.optional.h264_hw",
      "group": "capabilities",
      "status": "skip",
      "severity": "recommended",
      "claimed_by": [
        "feature:h264_hw"
      ],
      "message": "optional h264_hw unavailable: no hardware H.264 encoder was found (NVENC, VA-API, QSV, AMF)",
      "remediation": "",
      "duration_ms": 0,
      "facts": {
        "skip_reason": "optional_unavailable"
      },
      "artifacts": []
    },
    {
      "id": "capabilities.optional.quic_media",
      "group": "capabilities",
      "status": "pass",
      "severity": "recommended",
      "claimed_by": [
        "feature:quic_media"
      ],
      "message": "quic_media supported",
      "remediation": "",
      "duration_ms": 0,
      "facts": {},
      "artifacts": []
    },
    {
      "id": "capabilities.optional.launch_app",
      "group": "capabilities",
      "status": "pass",
      "severity": "recommended",
      "claimed_by": [
        "feature:launch_app"
      ],
      "message": "launch_app supported",
      "remediation": "",
      "duration_ms": 0,
      "facts": {},
      "artifacts": []
    },
    {
      "id": "capabilities.optional.clipboard.text",
      "group": "capabilities",
      "status": "pass",
      "severity": "recommended",
      "claimed_by": [
        "feature:clipboard.text"
      ],
      "message": "clipboard.text supported",
      "remediation": "",
      "duration_ms": 0,
      "facts": {},
      "artifacts": []
    },
    {
      "id": "capabilities.optional.clipboard.files",
      "group": "capabilities",
      "status": "pass",
      "severity": "recommended",
      "claimed_by": [
        "feature:clipboard.files"
      ],
      "message": "clipboard.files supported",
      "remediation": "",
      "duration_ms": 0,
      "facts": {},
      "artifacts": []
    },
    {
      "id": "capabilities.optional.clipboard.image",
      "group": "capabilities",
      "status": "pass",
      "severity": "recommended",
      "claimed_by": [
        "feature:clipboard.image"
      ],
      "message": "clipboard.image supported",
      "remediation": "",
      "duration_ms": 0,
      "facts": {},
      "artifacts": []
    },
    {
      "id": "capabilities.optional.presence",
      "group": "capabilities",
      "status": "pass",
      "severity": "recommended",
      "claimed_by": [
        "feature:presence"
      ],